{
  "candidates": [
    {
      "candidate_id": "C01",
      "title": "Clinics lose revenue to appointment no-shows",
      "problem": "Clinics lose revenue to appointment no-shows",
      "customer": "Saudi SMB owners",
      "segment": "B2B",
      "sector": "services",
      "opportunity_type": "NEW_OPPORTUNITY",
      "time_horizon": "CURRENT_EVIDENCE",
      "member_signal_ids": [
        "S001"
      ],
      "potential_solution": "SaaS",
      "business_model": "subscription",
      "priority": 5,
      "priority_rationale": "mock",
      "open_questions": [],
      "source_agents": [
        "problem_hunter"
      ],
      "evidence": [
        {
          "claim": "Clinics lose revenue to appointment no-shows",
          "url": "https://example.org/problem_hunter/1",
          "source_title": "mock source",
          "summary": "mock",
          "evidence_type": "DIRECT",
          "published": "2026"
        }
      ],
      "existing_solutions": [],
      "foreign_models": [],
      "workarounds": [
        "Excel"
      ],
      "existing_spend": [
        "NO RELIABLE EVIDENCE FOUND"
      ],
      "unknowns": []
    },
    {
      "candidate_id": "C02",
      "title": "KILLME paid prayer-times app",
      "problem": "KILLME paid prayer-times app",
      "customer": "Saudi SMB owners",
      "segment": "B2B",
      "sector": "services",
      "opportunity_type": "NEW_OPPORTUNITY",
      "time_horizon": "CURRENT_EVIDENCE",
      "member_signal_ids": [
        "S002"
      ],
      "potential_solution": "SaaS",
      "business_model": "subscription",
      "priority": 5,
      "priority_rationale": "mock",
      "open_questions": [],
      "source_agents": [
        "problem_hunter"
      ],
      "evidence": [
        {
          "claim": "KILLME paid prayer-times app",
          "url": "https://example.org/problem_hunter/2",
          "source_title": "mock source",
          "summary": "mock",
          "evidence_type": "DIRECT",
          "published": "2026"
        }
      ],
      "existing_solutions": [],
      "foreign_models": [],
      "workarounds": [
        "Excel"
      ],
      "existing_spend": [
        "NO RELIABLE EVIDENCE FOUND"
      ],
      "unknowns": []
    },
    {
      "candidate_id": "C03",
      "title": "Contractors track progress payments in Excel",
      "problem": "Contractors track progress payments in Excel",
      "customer": "Saudi SMB owners",
      "segment": "B2B",
      "sector": "services",
      "opportunity_type": "NEW_OPPORTUNITY",
      "time_horizon": "CURRENT_EVIDENCE",
      "member_signal_ids": [
        "S004"
      ],
      "potential_solution": "SaaS",
      "business_model": "subscription",
      "priority": 5,
      "priority_rationale": "mock",
      "open_questions": [],
      "source_agents": [
        "b2b_hunter"
      ],
      "evidence": [
        {
          "claim": "Contractors track progress payments in Excel",
          "url": "https://example.org/b2b_hunter/2",
          "source_title": "mock source",
          "summary": "mock",
          "evidence_type": "DIRECT",
          "published": "2026"
        }
      ],
      "existing_solutions": [],
      "foreign_models": [],
      "workarounds": [
        "Excel"
      ],
      "existing_spend": [
        "NO RELIABLE EVIDENCE FOUND"
      ],
      "unknowns": []
    },
    {
      "candidate_id": "C04",
      "title": "b2c_hunter pain about manual reporting",
      "problem": "b2c_hunter pain about manual reporting",
      "customer": "Saudi SMB owners",
      "segment": "B2B",
      "sector": "services",
      "opportunity_type": "NEW_OPPORTUNITY",
      "time_horizon": "CURRENT_EVIDENCE",
      "member_signal_ids": [
        "S005"
      ],
      "potential_solution": "SaaS",
      "business_model": "subscription",
      "priority": 5,
      "priority_rationale": "mock",
      "open_questions": [],
      "source_agents": [
        "b2c_hunter"
      ],
      "evidence": [
        {
          "claim": "b2c_hunter pain about manual reporting",
          "url": "https://example.org/b2c_hunter/1",
          "source_title": "mock source",
          "summary": "mock",
          "evidence_type": "DIRECT",
          "published": "2026"
        }
      ],
      "existing_solutions": [],
      "foreign_models": [],
      "workarounds": [
        "Excel"
      ],
      "existing_spend": [
        "NO RELIABLE EVIDENCE FOUND"
      ],
      "unknowns": []
    }
  ],
  "backlog": [],
  "discarded": [],
  "merge_notes": "mock"
}