{
  "candidates": [
    {
      "candidate_id": "C01",
      "title": "Low-cost ZATCA Phase 2 e-invoicing compliance middleware for micro/small Saudi merchants",
      "problem": "Saudi SMEs (retail, restaurants, professional services, contractors) are being swept into mandatory ZATCA e-invoicing Phase 2 (real-time XML invoicing, cryptographic stamp, QR code, Fatoora ERP integration). Wave 24 lowered the mandatory threshold to SAR 375,000 annual revenue, pulling in large numbers of small businesses with no in-house IT capability for API integration, XML schema compliance or certificate management.",
      "customer": "Micro and small Saudi businesses newly in ZATCA Phase 2 scope (annual revenue as low as SAR 375,000) currently invoicing manually or with basic accounting software",
      "segment": "B2B",
      "sector": "SMB compliance / retail / professional services",
      "opportunity_type": "EXISTING_MARKET",
      "time_horizon": "CURRENT_EVIDENCE",
      "member_signal_ids": [
        "S002"
      ],
      "potential_solution": "Lightweight, very-low-cost ZATCA Phase 2 integration middleware/plugin targeted at micro and small merchants under SAR 1M revenue who are priced out of enterprise ERP vendors — simple onboarding, WhatsApp/Arabic support, flat low monthly fee",
      "business_model": "SaaS subscription (flat low monthly fee) or one-time setup + small monthly compliance fee",
      "priority": 8,
      "priority_rationale": "A regulatory mandate (not a discretionary want) creates a forced, recurring, ever-expanding need as thresholds drop, guaranteeing demand durability. Multiple established competitors (Wafeq, Qeemah Cloud, InvoiceQ, Tally) give STRONG_INDIRECT evidence that SMEs already pay for this class of solution, de-risking the business-model question. Severity and frequency are both rated HIGH. The MVP is buildable by a solo founder as API/middleware without requiring a hard licence (ZATCA compliance is a requirement to satisfy, not a licence to obtain). Priority is not maximal because the space is already fairly crowded, exact micro-merchant price points are unverified, and it is unclear how much of the market is already captured by incumbents vs. genuinely underserved micro-merchants.",
      "open_questions": [
        "What price points can micro-merchants (<SAR 1M revenue) actually afford/pay for compliance software?",
        "How saturated is the micro-merchant segment already vs. mid-size firms served by Wafeq/Qeemah/InvoiceQ?",
        "Does ZATCA itself offer a free/simplified integration path that would undercut a paid tool?",
        "What certification/onboarding process does ZATCA require for a new third-party solution provider, and is it feasible for a solo founder?"
      ]
    },
    {
      "candidate_id": "C02",
      "title": "WhatsApp-based appointment reminder & booking micro-SaaS for small clinics",
      "problem": "Small private clinics and dental practices in Saudi Arabia experience high patient no-show rates and spend receptionist time manually calling/reminding patients; published Saudi clinical research shows no-show rates up to 39.8% without reminder systems.",
      "customer": "Small private clinics and dental practices in Saudi Arabia without enterprise-grade clinic management software",
      "segment": "B2B",
      "sector": "Clinics / healthcare SMB",
      "opportunity_type": "EXISTING_MARKET",
      "time_horizon": "CURRENT_EVIDENCE",
      "member_signal_ids": [
        "S004"
      ],
      "potential_solution": "Very low-cost WhatsApp-based appointment reminder + booking micro-SaaS targeted at single-doctor/small clinics, priced below existing local vendors, simple self-serve setup",
      "business_model": "Low monthly SaaS subscription per clinic, possibly usage-based on WhatsApp messages sent",
      "priority": 7,
      "priority_rationale": "DIRECT evidence (a Saudi clinical study showing up to 39.8% no-show rate) confirms the underlying pain is real and quantifiable, and STRONG_INDIRECT evidence (existing local paid vendors Snad, Yolo.clinic, automation-ksa.com) confirms clinics already pay to solve it. Frequency is HIGH (daily/recurring scheduling pain). The MVP fits squarely in the solo-founder EASY/MODERATE band — a WhatsApp Business API integration is buildable within the 500–1000 SAR budget. Ranked just below C01 because severity is only rated MEDIUM (a scheduling inefficiency rather than a forced compliance cost), no confirmed pricing evidence was captured for the specific fee level, and there is already local competition targeting the same small-clinic niche.",
      "open_questions": [
        "What do Snad and Yolo.clinic actually charge, and is there room for a materially cheaper alternative?",
        "Is the 1-2 doctor clinic segment already saturated by free/cheap WhatsApp automation tools?",
        "Is the 39.8% no-show figure (older study) still representative in 2025-2026, or has it shifted?",
        "What are the cost/quota constraints of the WhatsApp Business API for a solo founder at small scale, and do they threaten unit economics?"
      ]
    }
  ],
  "backlog": [
    {
      "title": "Tenant/landlord & off-plan buyer dispute resolution assistant (Najiz/REGA guided filing tool)",
      "member_signal_ids": [
        "S001"
      ],
      "reason_not_prioritized": "Evidence on filing frequency and severity is weak/unverified (no GASTAT/REGA statistics found), monetization is unclear, and the tool would compete directly with free official government channels (Najiz, REGA e-Participation) that the customer could use directly. Also carries legal-advice adjacency risk that needs clarification before building."
    },
    {
      "title": "Subcontractor progress-payment (مستخلصات) tracking SaaS for Saudi construction firms",
      "member_signal_ids": [
        "S003"
      ],
      "reason_not_prioritized": "No existing competing solutions were found at all, which is a warning sign of untested demand rather than a clean blue ocean; confidence is LOW and evidence mostly WEAK; unclear whether subcontractors would pay for a tracking tool or continue to treat delayed payments as a purely legal/relationship issue; no data found on the actual scale of affected firms."
    }
  ],
  "discarded": [],
  "merge_notes": "No exact or near-duplicate pains were found across the 4 input signals — each describes a distinct customer segment and problem (tenant/buyer real-estate disputes; ZATCA e-invoicing compliance for SMEs; subcontractor progress-payment delays; clinic patient no-shows), so no signals were merged into a shared candidate. Ranking (limited to 2 by candidate_limit) favored the two signals with the strongest combination of evidence class (DIRECT/STRONG_INDIRECT), proof of existing paid competitors (de-risking willingness-to-pay), high frequency/severity, and solo-founder MVP feasibility within the 500-1000 SAR budget: ZATCA compliance middleware (C01, regulatory-driven, existing paid competitors) and clinic no-show WhatsApp reminders (C02, DIRECT clinical evidence + existing paid local vendors). The real-estate dispute tool (S001) and subcontractor payment tracker (S003) were pushed to backlog due to weaker/unverified evidence and unclear monetization paths. Nothing was discarded outright since all four signals contain at least some plausible evidence and none require a hard licence or heavy field operations."
}