{
  "candidates": [
    {
      "candidate_id": "C01",
      "title": "Clinics lose revenue to appointment no-shows",
      "problem": "Clinics lose revenue to appointment no-shows",
      "customer": "Saudi SMB owners",
      "segment": "B2B",
      "sector": "services",
      "opportunity_type": "NEW_OPPORTUNITY",
      "time_horizon": "CURRENT_EVIDENCE",
      "member_signal_ids": [
        "S001"
      ],
      "potential_solution": "SaaS",
      "business_model": "subscription",
      "priority": 5,
      "priority_rationale": "mock",
      "open_questions": []
    },
    {
      "candidate_id": "C02",
      "title": "KILLME paid prayer-times app",
      "problem": "KILLME paid prayer-times app",
      "customer": "Saudi SMB owners",
      "segment": "B2B",
      "sector": "services",
      "opportunity_type": "NEW_OPPORTUNITY",
      "time_horizon": "CURRENT_EVIDENCE",
      "member_signal_ids": [
        "S002"
      ],
      "potential_solution": "SaaS",
      "business_model": "subscription",
      "priority": 5,
      "priority_rationale": "mock",
      "open_questions": []
    },
    {
      "candidate_id": "C03",
      "title": "Contractors track progress payments in Excel",
      "problem": "Contractors track progress payments in Excel",
      "customer": "Saudi SMB owners",
      "segment": "B2B",
      "sector": "services",
      "opportunity_type": "NEW_OPPORTUNITY",
      "time_horizon": "CURRENT_EVIDENCE",
      "member_signal_ids": [
        "S004"
      ],
      "potential_solution": "SaaS",
      "business_model": "subscription",
      "priority": 5,
      "priority_rationale": "mock",
      "open_questions": []
    },
    {
      "candidate_id": "C04",
      "title": "b2c_hunter pain about manual reporting",
      "problem": "b2c_hunter pain about manual reporting",
      "customer": "Saudi SMB owners",
      "segment": "B2B",
      "sector": "services",
      "opportunity_type": "NEW_OPPORTUNITY",
      "time_horizon": "CURRENT_EVIDENCE",
      "member_signal_ids": [
        "S005"
      ],
      "potential_solution": "SaaS",
      "business_model": "subscription",
      "priority": 5,
      "priority_rationale": "mock",
      "open_questions": []
    }
  ],
  "backlog": [],
  "discarded": [],
  "merge_notes": "mock"
}